trackName,lyric_line,lyric_full,lyric_jieba,lyric_ckip
擱淺 DEMO,"['窗外的美麗蝴蝶 我真的看不見退回 衝動 熟悉的真的感覺', '衝動齊衝去窗外 我真麽感受這不來 許我就愛 就記得較近挽台', '差點擡頭看的承諾 我記得記得確定 我真的看不見 我真的太想來', '雨下整夜我愛沒重來 院子落葉厚厚一疊 你幾句化身對待 我真的較見空間不來', '我睜開雙眼看著空白 我綁起得重頭醒來 我等不離開 你怎麽毀壞', '寫一個空間蒼白 我真的看不懂簡單 始終 往事地鐵空曠來', '我真的給了個等待 我真的無法來給 我怎麼學得會 妳危急這無奈', '我睜開雙眼看著空白 懷疑空著位留妳給 我怎麼學得會 我憎我疚我不能信賴', '我睜開雙眼看著空白 我的一切等待期待 給了我等待 卻等了空', '我 睜開雙眼看著空白 忘記妳正等著期待 我怎麼學得會 我真的睜眼望著妳愛', '我睜開雙眼看著等待 為了記得記得空白 我等待離開 我真的重來']",窗外的美麗蝴蝶，我真的看不見退回，衝動，熟悉的真的感覺。衝動齊衝去窗外，我真麽感受這不來，許我就愛，就記得較近挽台。差點擡頭看的承諾，我記得記得確定，我真的看不見，我真的太想來。雨下整夜我愛沒重來，院子落葉厚厚一疊，你幾句化身對待，我真的較見空間不來。我睜開雙眼看著空白，我綁起得重頭醒來，我等不離開，你怎麽毀壞。寫一個空間蒼白，我真的看不懂簡單，始終，往事地鐵空曠來。我真的給了個等待，我真的無法來給，我怎麼學得會，妳危急這無奈。我睜開雙眼看著空白，懷疑空著位留妳給，我怎麼學得會，我憎我疚我不能信賴。我睜開雙眼看著空白，我的一切等待期待，給了我等待，卻等了空。我，睜開雙眼看著空白，忘記妳正等著期待，我怎麼學得會，我真的睜眼望著妳愛。我睜開雙眼看著等待，為了記得記得空白，我等待離開，我真的重來,"['窗外', '的', '美麗', '蝴蝶', '，', '我', '真的', '看不見', '退回', '，', '衝動', '，', '熟悉', '的', '真的', '感覺', '。', '衝動', '齊衝', '去', '窗外', '，', '我', '真', '麽', '感受', '這不來', '，', '許我', '就', '愛', '，', '就', '記得', '較', '近', '挽台', '。', '差', '點', '擡', '頭', '看', '的', '承', '諾', '，', '我', '記得', '記得', '確定', '，', '我', '真的', '看不見', '，', '我', '真的', '太想', '來', '。', '雨下', '整夜', '我愛沒', '重來', '，', '院子', '落葉', '厚厚', '一疊', '，', '你', '幾句', '化身', '對待', '，', '我', '真的', '較見', '空間', '不來', '。', '我睜', '開雙', '眼看', '著', '空白', '，', '我', '綁', '起', '得', '重頭', '醒', '來', '，', '我', '等', '不', '離開', '，', '你', '怎', '麽', '毀壞', '。', '寫', '一個', '空間', '蒼白', '，', '我', '真的', '看不懂', '簡單', '，', '始終', '，', '往事', '地鐵空', '曠來', '。', '我', '真的', '給了', '個', '等待', '，', '我', '真的', '無法', '來給', '，', '我', '怎麼', '學得會', '，', '妳', '危急', '這無奈', '。', '我睜', '開雙', '眼看', '著', '空白', '，', '懷疑', '空著位', '留', '妳', '給', '，', '我', '怎麼', '學得會', '，', '我憎', '我疚', '我', '不能', '信賴', '。', '我睜', '開雙', '眼看', '著', '空白', '，', '我', '的', '一切', '等待', '期待', '，', '給了', '我', '等待', '，', '卻', '等', '了', '空', '。', '我', '，', '睜開雙', '眼看', '著', '空白', '，', '忘記', '妳', '正', '等', '著', '期待', '，', '我', '怎麼', '學得會', '，', '我', '真的', '睜眼望', '著', '妳', '愛', '。', '我睜', '開雙', '眼看', '著', '等待', '，', '為', '了', '記得', '記得', '空白', '，', '我', '等待', '離開', '，', '我', '真的', '重來']","['窗', '外', '的', '美麗', '蝴蝶', '，', '我', '真的', '看', '不', '見', '退回', '，', '衝動', '，', '熟悉', '的', '真的', '感覺', '。', '衝動', '齊', '衝', '去', '窗', '外', '，', '我', '真', '麽', '感受', '這', '不', '來', '，', '許', '我', '就', '愛', '，', '就', '記得', '較', '近', '挽台', '。', '差點', '擡頭', '看', '的', '承諾', '，', '我', '記得', '記得', '確定', '，', '我', '真的', '看', '不', '見', '，', '我', '真的', '太', '想', '來', '。', '雨', '下', '整', '夜', '我', '愛', '沒', '重來', '，', '院子', '落葉', '厚厚', '一', '疊', '，', '你', '幾', '句', '化身', '對待', '，', '我', '真的', '較', '見', '空間', '不', '來', '。', '我', '睜開', '雙眼', '看', '著', '空白', '，', '我', '綁', '起', '得', '重頭', '醒來', '，', '我等', '不', '離開', '，', '你', '怎', '麽', '毀壞', '。', '寫', '一', '個', '空間', '蒼白', '，', '我', '真的', '看', '不', '懂', '簡單', '，', '始終', '，', '往事', '地鐵', '空曠', '來', '。', '我', '真的', '給', '了', '個', '等待', '，', '我', '真的', '無法', '來', '給', '，', '我', '怎麼', '學得', '會', '，', '妳', '危急', '這', '無奈', '。', '我', '睜開', '雙眼', '看', '著', '空白', '，', '懷疑', '空', '著', '位', '留', '妳', '給', '，', '我', '怎麼', '學得', '會', '，', '我', '憎', '我', '疚', '我', '不能', '信賴', '。', '我', '睜開', '雙眼', '看', '著', '空白', '，', '我', '的', '一切', '等待', '期待', '，', '給', '了', '我', '等待', '，', '卻', '等', '了', '空', '。', '我', '，', '睜開', '雙眼', '看', '著', '空白', '，', '忘記', '妳', '正', '等', '著', '期待', '，', '我', '怎麼', '學得', '會', '，', '我', '真的', '睜眼', '望', '著', '妳', '愛', '。', '我', '睜開', '雙眼', '看', '著', '等待', '，', '為了', '記得', '記得', '空白', '，', '我', '等待', '離開', '，', '我', '真的', '重來']"
最偉大的作品,"['哥穿著復古西裝拿著手杖彈著魔法樂章 漫步走在莎瑪麗丹被歲月翻新的時光 望不到邊界的帝國用音符築成的王座 我用琴鍵穿梭錯過的不朽', '啊偏執是那馬格利特被我變出的蘋果 超現實的是我還是他原本想畫的小丑 不是煙斗的煙斗臉上的鴿子沒有飛走 請你記得他是個畫家不是什麼調酒', '達利翹鬍是誰給他的思索彎了湯匙借你靈感不用還我 融化的是牆上時鐘還是乳酪龍蝦電話那頭你都不回我', '浪蕩是世俗畫作裡最自由不拘的水墨 花都優雅的雙腿是這宇宙筆下的一抹 飄洋過海的鄉愁種在一無所有的溫柔 寂寞的枝頭才能長出常玉要的花朵', '小船靜靜往返馬諦斯的海岸 星空下的夜晚交給梵谷點燃 夢美的太短暫孟克橋上吶喊 這世上的熱鬧出自孤單', '世代的狂音樂的王萬物臣服在我樂章 路還在闖我還在創指尖的旋律在渴望 世代的狂音樂的王我想我不需要畫框 它框不住琴鍵的速度我的音符全部是未來藝術', '日出在印象的港口來回光線喚醒了睡著的花葉 草地正為一場小雨歡悅我們彼此深愛這個世界 停在康橋上的那隻蝴蝶飛往午夜河畔的翡冷翠 遺憾被偶然藏在了詩頁是微笑都透不進的世界', '巴黎的鱗爪感傷的文法要用音樂翻閱 晚風的燈下旅人的花茶我換成了咖啡 之後他就愛上了苦澀這個複雜詞彙 因為這才是揮手向雲彩道別的滋味', '小船靜靜往返馬諦斯的海岸 星空下的夜晚交給梵谷點燃 夢美的太短暫孟克橋上吶喊 這世上的熱鬧出自孤單']",哥穿著復古西裝拿著手杖彈著魔法樂章，漫步走在莎瑪麗丹被歲月翻新的時光，望不到邊界的帝國用音符築成的王座，我用琴鍵穿梭錯過的不朽。啊偏執是那馬格利特被我變出的蘋果，超現實的是我還是他原本想畫的小丑，不是煙斗的煙斗臉上的鴿子沒有飛走，請你記得他是個畫家不是什麼調酒。達利翹鬍是誰給他的思索彎了湯匙借你靈感不用還我，融化的是牆上時鐘還是乳酪龍蝦電話那頭你都不回我。浪蕩是世俗畫作裡最自由不拘的水墨，花都優雅的雙腿是這宇宙筆下的一抹，飄洋過海的鄉愁種在一無所有的溫柔，寂寞的枝頭才能長出常玉要的花朵。小船靜靜往返馬諦斯的海岸，星空下的夜晚交給梵谷點燃，夢美的太短暫孟克橋上吶喊，這世上的熱鬧出自孤單。世代的狂音樂的王萬物臣服在我樂章，路還在闖我還在創指尖的旋律在渴望，世代的狂音樂的王我想我不需要畫框，它框不住琴鍵的速度我的音符全部是未來藝術。日出在印象的港口來回光線喚醒了睡著的花葉，草地正為一場小雨歡悅我們彼此深愛這個世界，停在康橋上的那隻蝴蝶飛往午夜河畔的翡冷翠，遺憾被偶然藏在了詩頁是微笑都透不進的世界。巴黎的鱗爪感傷的文法要用音樂翻閱，晚風的燈下旅人的花茶我換成了咖啡，之後他就愛上了苦澀這個複雜詞彙，因為這才是揮手向雲彩道別的滋味。小船靜靜往返馬諦斯的海岸，星空下的夜晚交給梵谷點燃，夢美的太短暫孟克橋上吶喊，這世上的熱鬧出自孤單,"['哥', '穿著', '復', '古西裝', '拿', '著', '手杖', '彈著', '魔法', '樂章', '，', '漫步', '走', '在', '莎瑪麗丹', '被', '歲', '月', '翻新', '的', '時光', '，', '望', '不到', '邊界', '的', '帝國用', '音符', '築成', '的', '王座', '，', '我用', '琴鍵', '穿梭', '錯過', '的', '不朽', '。', '啊', '偏', '執是', '那馬', '格利', '特', '被', '我', '變出', '的', '蘋果', '，', '超現實', '的', '是', '我', '還是', '他', '原本', '想畫', '的', '小丑', '，', '不是', '煙斗', '的', '煙斗臉', '上', '的', '鴿子', '沒', '有', '飛', '走', '，', '請', '你', '記得', '他', '是', '個', '畫家', '不是', '什麼', '調酒', '。', '達利', '翹', '鬍', '是', '誰', '給', '他', '的', '思索', '彎', '了', '湯匙', '借', '你', '靈感', '不用', '還我', '，', '融化', '的', '是', '牆', '上', '時鐘', '還是', '乳酪', '龍蝦', '電話', '那頭', '你', '都', '不', '回', '我', '。', '浪', '蕩', '是', '世俗', '畫作裡', '最', '自由', '不拘', '的', '水墨', '，', '花都', '優雅', '的', '雙腿', '是', '這', '宇宙', '筆下', '的', '一抹', '，', '飄洋', '過海', '的', '鄉', '愁種', '在', '一', '無', '所有', '的', '溫柔', '，', '寂寞', '的', '枝頭', '才能', '長', '出常玉要', '的', '花朵', '。', '小船', '靜靜', '往返', '馬', '諦', '斯', '的', '海岸', '，', '星空', '下', '的', '夜晚', '交給', '梵谷', '點燃', '，', '夢', '美的', '太短', '暫孟克橋', '上', '吶喊', '，', '這', '世上', '的', '熱鬧', '出自', '孤單', '。', '世代', '的', '狂音樂', '的', '王萬物', '臣服', '臣服在', '我樂章', '，', '路', '還在', '闖', '我', '還在', '創', '指尖', '的', '旋律', '在', '渴望', '，', '世代', '的', '狂音樂', '的', '王', '我', '想', '我', '不', '需要', '畫框', '，', '它框', '不住', '琴鍵', '的', '速度', '我', '的', '音符', '全部', '是', '未來', '藝術', '。', '日出', '在', '印象', '的', '港口', '來', '回光線', '喚醒', '了', '睡', '著', '的', '花葉', '，', '草地', '正為', '一場', '小雨', '歡悅', '我們', '彼此', '深愛這個', '世界', '，', '停', '在', '康橋', '上', '的', '那', '隻', '蝴蝶', '飛往', '午夜', '河畔', '的', '翡冷翠', '，', '遺憾', '被', '偶然', '藏', '在', '了', '詩頁', '是', '微笑', '都', '透不進', '的', '世界', '。', '巴黎', '的', '鱗爪', '感傷', '的', '文法', '要用', '音樂', '翻閱', '，', '晚風', '的', '燈下', '旅人', '的', '花茶', '我換成', '了', '咖啡', '，', '之後他', '就', '愛上', '了', '苦澀', '這個', '複', '雜詞', '彙', '，', '因為', '這才', '是', '揮手', '向', '雲彩道', '別', '的', '滋味', '。', '小船', '靜靜', '往返', '馬', '諦', '斯', '的', '海岸', '，', '星空', '下', '的', '夜晚', '交給', '梵谷', '點燃', '，', '夢', '美的', '太短', '暫孟克橋', '上', '吶喊', '，', '這', '世上', '的', '熱鬧', '出自', '孤單']","['哥', '穿著', '復古', '西裝', '拿', '著', '手杖', '彈', '著', '魔法', '樂章', '，', '漫步', '走', '在', '莎瑪麗丹', '被', '歲月', '翻新', '的', '時光', '，', '望', '不', '到', '邊界', '的', '帝國', '用', '音符', '築成', '的', '王座', '，', '我', '用', '琴鍵', '穿梭', '錯過', '的', '不朽', '。', '啊', '偏執', '是', '那馬格利特', '被', '我', '變出', '的', '蘋果', '，', '超現實', '的', '是', '我', '還是', '他', '原本', '想', '畫', '的', '小丑', '，', '不', '是', '煙斗', '的', '煙斗', '臉', '上', '的', '鴿子', '沒有', '飛走', '，', '請', '你', '記得', '他', '是', '個', '畫家', '不', '是', '什麼', '調酒', '。', '達利', '翹鬍', '是', '誰', '給', '他', '的', '思索', '彎', '了', '湯匙', '借', '你', '靈感', '不用', '還', '我', '，', '融化', '的', '是', '牆', '上', '時鐘', '還是', '乳酪', '龍蝦', '電話', '那', '頭', '你', '都', '不', '回', '我', '。', '浪蕩', '是', '世俗', '畫作', '裡', '最', '自由', '不拘', '的', '水墨', '，', '花', '都', '優雅', '的', '雙腿', '是', '這', '宇宙', '筆下', '的', '一', '抹', '，', '飄洋過海', '的', '鄉愁', '種', '在', '一無所有', '的', '溫柔', '，', '寂寞', '的', '枝頭', '才', '能', '長出', '常玉', '要', '的', '花朵', '。', '小', '船', '靜靜', '往返', '馬諦斯', '的', '海岸', '，', '星空', '下', '的', '夜晚', '交給', '梵谷', '點燃', '，', '夢美', '的', '太', '短暫', '孟克橋', '上', '吶喊', '，', '這', '世上', '的', '熱鬧', '出自', '孤單', '。', '世代', '的', '狂', '音樂', '的', '王萬物', '臣服', '在', '我', '樂章', '，', '路', '還', '在', '闖', '我', '還', '在', '創', '指尖', '的', '旋律', '在', '渴望', '，', '世代', '的', '狂音樂', '的', '王我', '想', '我', '不', '需要', '畫框', '，', '它', '框', '不', '住', '琴鍵', '的', '速度', '我', '的', '音符', '全部', '是', '未來', '藝術', '。', '日出', '在', '印象', '的', '港口', '來回', '光線', '喚醒', '了', '睡著', '的', '花葉', '，', '草地', '正', '為', '一', '場', '小', '雨', '歡悅', '我們', '彼此', '深', '愛', '這', '個', '世界', '，', '停', '在', '康橋', '上', '的', '那', '隻', '蝴蝶', '飛往', '午夜', '河', '畔', '的', '翡冷翠', '，', '遺憾', '被', '偶然', '藏', '在', '了', '詩頁', '是', '微笑', '都', '透', '不', '進', '的', '世界', '。', '巴黎', '的', '鱗爪', '感傷', '的', '文法', '要', '用', '音樂', '翻閱', '，', '晚風', '的', '燈', '下', '旅人', '的', '花茶', '我', '換成', '了', '咖啡', '，', '之後', '他', '就', '愛上', '了', '苦澀', '這', '個', '複雜', '詞彙', '，', '因為', '這', '才', '是', '揮手', '向', '雲彩', '道別', '的', '滋味', '。', '小', '船', '靜靜', '往返', '馬諦斯', '的', '海岸', '，', '星空', '下', '的', '夜晚', '交給', '梵谷', '點燃', '，', '夢美', '的', '太', '短暫', '孟克橋', '上', '吶喊', '，', '這', '世上', '的', '熱鬧', '出自', '孤單']"
還在流浪,"['老書攤  和啤酒空罐  散落地上 報廢的回憶在路旁  有了鏽斑 有某種無所謂  在這小鎮瀰漫 這個城市步調  是如此的緩慢', '霓虹燈閃爍的倒影  靠在窗上 錯過美好的那時光  能否再遇上 老舊的車站  空曠的車廂 懷念從前的人來人往', '當你收到信  我還在流浪 那年的約定  都放在心上 隨身的照片裡  你微笑的模樣 親愛的  你現在怎麼樣', '當你收到信  我還在流浪 想起牽著手  走過的小巷 我依然記得  年少初吻的那教堂 還有一起畫愛心  的那道牆']",老書攤，和啤酒空罐，散落地上，報廢的回憶在路旁，有了鏽斑，有某種無所謂，在這小鎮瀰漫，這個城市步調，是如此的緩慢。霓虹燈閃爍的倒影，靠在窗上，錯過美好的那時光，能否再遇上，老舊的車站，空曠的車廂，懷念從前的人來人往。當你收到信，我還在流浪，那年的約定，都放在心上，隨身的照片裡，你微笑的模樣，親愛的，你現在怎麼樣。當你收到信，我還在流浪，想起牽著手，走過的小巷，我依然記得，年少初吻的那教堂，還有一起畫愛心，的那道牆,"['老書攤', '，', '和', '啤酒', '空罐', '，', '散落', '地上', '，', '報廢', '的', '回憶', '在', '路旁', '，', '有', '了', '鏽', '斑', '，', '有', '某種', '無所謂', '，', '在', '這小鎮', '瀰', '漫', '，', '這個', '城市', '步調', '，', '是', '如此', '的', '緩慢', '。', '霓虹', '燈閃爍', '的', '倒影', '，', '靠', '在', '窗上', '，', '錯過', '美好', '的', '那', '時光', '，', '能否', '再', '遇上', '，', '老舊', '的', '車站', '，', '空曠', '的', '車廂', '，', '懷念', '從', '前', '的', '人來', '人往', '。', '當你', '收到', '信', '，', '我', '還在', '流浪', '，', '那年', '的', '約定', '，', '都', '放在', '心上', '放在心上', '，', '隨身', '的', '照片', '裡', '，', '你', '微笑', '的', '模樣', '，', '親愛的', '，', '你現', '在', '怎麼樣', '。', '當你', '收到', '信', '，', '我', '還在', '流浪', '，', '想起', '牽著手', '，', '走過', '的', '小巷', '，', '我', '依然', '記得', '，', '年少', '初吻', '的', '那', '教堂', '，', '還有', '一起', '畫愛心', '，', '的', '那', '道', '牆']","['老', '書攤', '，', '和', '啤酒', '空罐', '，', '散落', '地', '上', '，', '報廢', '的', '回憶', '在', '路', '旁', '，', '有', '了', '鏽斑', '，', '有', '某', '種', '無所謂', '，', '在', '這', '小鎮', '瀰漫', '，', '這', '個', '城市', '步調', '，', '是', '如此', '的', '緩慢', '。', '霓虹燈', '閃爍', '的', '倒影', '，', '靠在', '窗', '上', '，', '錯過', '美好', '的', '那', '時光', '，', '能否', '再', '遇上', '，', '老舊', '的', '車站', '，', '空曠', '的', '車廂', '，', '懷念', '從前', '的', '人來人往', '。', '當', '你', '收到', '信', '，', '我', '還', '在', '流浪', '，', '那', '年', '的', '約定', '，', '都', '放', '在', '心', '上', '，', '隨身', '的', '照片', '裡', '，', '你', '微笑', '的', '模樣', '，', '親愛的', '，', '你', '現在', '怎麼樣', '。', '當', '你', '收到', '信', '，', '我', '還', '在', '流浪', '，', '想起', '牽', '著', '手', '，', '走過', '的', '小', '巷', '，', '我', '依然', '記得', '，', '年少', '初吻', '的', '那', '教堂', '，', '還', '有', '一起', '畫', '愛心', '，', '的', '那', '道', '牆']"
說好不哭,"['五月天阿信', '∕沒有了聯絡  後來的生活  我都是聽別人說      說妳怎麼了  說妳怎麼過  放不下的人是我      人多的時候  就待在角落  就怕別人問起我      你們怎麼了  妳低著頭  護著我連抱怨都沒有', '電話開始躲  從不對我說  不習慣一個人生活      離開我以後  要我好好過  怕打擾想自由的我      都這個時候  妳還在意著  別人是怎麼怎麼看我的      拼命解釋著  不是我的錯  是妳要走', '∕電話開始躲  從不對我說  不習慣一個人生活      離開我以後  要我好好過  怕打擾想自由的我      都這個時候  你還在意著∕這個時候  別人是怎麼怎麼看我的∕還在意著      拼命解釋著  不是我的錯  是妳要走 合∕眼看著妳難過  挽留的話卻沒有說      妳會微笑放手  說好不哭讓我走', '∕妳什麼都沒有  卻還為我的夢加油 ∕心疼過了多久∕過了多久  合∕還在找理由等我']",五月天阿信。∕沒有了聯絡，後來的生活，我都是聽別人說，說妳怎麼了，說妳怎麼過，放不下的人是我，人多的時候，就待在角落，就怕別人問起我，你們怎麼了，妳低著頭，護著我連抱怨都沒有。電話開始躲，從不對我說，不習慣一個人生活，離開我以後，要我好好過，怕打擾想自由的我，都這個時候，妳還在意著，別人是怎麼怎麼看我的，拼命解釋著，不是我的錯，是妳要走。∕電話開始躲，從不對我說，不習慣一個人生活，離開我以後，要我好好過，怕打擾想自由的我，都這個時候，你還在意著∕這個時候，別人是怎麼怎麼看我的∕還在意著，拼命解釋著，不是我的錯，是妳要走，合∕眼看著妳難過，挽留的話卻沒有說，妳會微笑放手，說好不哭讓我走。∕妳什麼都沒有，卻還為我的夢加油，∕心疼過了多久∕過了多久，合∕還在找理由等我,"['五月', '五月天', '阿信', '。', '∕', '沒有', '了', '聯絡', '，', '後', '來', '的', '生活', '，', '我', '都', '是', '聽別', '人', '說', '，', '說', '妳', '怎麼', '了', '，', '說', '妳', '怎麼過', '，', '不下', '放不下', '的', '人', '是', '我', '，', '人多', '的', '時候', '，', '就', '待', '在', '角落', '，', '就', '怕', '別人', '問起', '我', '，', '你們', '怎麼', '了', '，', '妳', '低', '著頭', '，', '護著', '我連', '抱怨', '都', '沒', '有', '。', '電話', '開始', '躲', '，', '從', '不', '對', '我', '說', '，', '不習慣', '一個', '人', '生活', '，', '離開', '我', '以', '後', '，', '要', '我', '好好', '過', '，', '怕', '打擾', '想', '自由', '的', '我', '，', '都', '這個', '時候', '，', '妳', '還', '在意', '著', '，', '別人', '是', '怎麼', '怎麼', '看', '我', '的', '，', '拼命', '解釋', '著', '，', '不是', '我', '的', '錯', '，', '是', '妳', '要', '走', '。', '∕', '電話', '開始', '躲', '，', '從', '不', '對', '我', '說', '，', '不習慣', '一個', '人', '生活', '，', '離開', '我', '以', '後', '，', '要', '我', '好好', '過', '，', '怕', '打擾', '想', '自由', '的', '我', '，', '都', '這個', '時候', '，', '你還', '在意', '著', '∕', '這個', '時候', '，', '別人', '是', '怎麼', '怎麼', '看', '我', '的', '∕', '還', '在意', '著', '，', '拼命', '解釋', '著', '，', '不是', '我', '的', '錯', '，', '是', '妳', '要', '走', '，', '合', '∕', '眼看', '著', '妳', '難過', '，', '挽留', '的', '話', '卻', '沒', '有', '說', '，', '妳', '會', '微笑', '放手', '，', '說', '好', '不', '哭', '讓', '我', '走', '。', '∕', '妳', '什麼', '都', '沒', '有', '，', '卻', '還為', '我', '的', '夢', '加油', '，', '∕', '心疼', '過了', '多久', '∕', '過了', '多久', '，', '合', '∕', '還在', '找', '理由', '等', '我']","['五月', '天', '阿信', '。', '∕', '沒有', '了', '聯絡', '，', '後來', '的', '生活', '，', '我', '都', '是', '聽', '別人', '說', '，', '說', '妳', '怎麼', '了', '，', '說', '妳', '怎麼', '過', '，', '放不下', '的', '人', '是', '我', '，', '人', '多', '的', '時候', '，', '就', '待在', '角落', '，', '就', '怕', '別人', '問起', '我', '，', '你們', '怎麼', '了', '，', '妳', '低', '著', '頭', '，', '護', '著', '我', '連', '抱怨', '都', '沒有', '。', '電話', '開始', '躲', '，', '從不', '對', '我', '說', '，', '不', '習慣', '一', '個', '人', '生活', '，', '離開', '我', '以後', '，', '要', '我', '好好', '過', '，', '怕', '打擾', '想', '自由', '的', '我', '，', '都', '這', '個', '時候', '，', '妳', '還', '在意', '著', '，', '別人', '是', '怎麼', '怎麼', '看', '我', '的', '，', '拼命', '解釋', '著', '，', '不', '是', '我', '的', '錯', '，', '是', '妳', '要', '走', '。', '∕', '電話', '開始', '躲', '，', '從不', '對', '我', '說', '，', '不', '習慣', '一', '個', '人', '生活', '，', '離開', '我', '以後', '，', '要', '我', '好好', '過', '，', '怕', '打擾', '想', '自由', '的', '我', '，', '都', '這', '個', '時候', '，', '你', '還', '在意', '著', '∕', '這', '個', '時候', '，', '別人', '是', '怎麼', '怎麼', '看', '我', '的', '∕', '還', '在意', '著', '，', '拼命', '解釋', '著', '，', '不', '是', '我', '的', '錯', '，', '是', '妳', '要', '走', '，', '合', '∕', '眼看著', '妳', '難過', '，', '挽留', '的話', '卻', '沒有', '說', '，', '妳', '會', '微笑', '放手', '，', '說好', '不', '哭', '讓', '我', '走', '。', '∕', '妳', '什麼', '都', '沒有', '，', '卻', '還', '為', '我', '的', '夢', '加油', '，', '∕', '心疼', '過', '了', '多久', '∕', '過', '了', '多久', '，', '合', '∕', '還', '在', '找', '理由', '等', '我']"
