trackName,lyric_line,lyric_full,lyric_jieba,lyric_ckip
十三號星期舞(Friday the 13th),"['剩女們明天打算請病假 情人節聽到巧克力就怕 小圈圈耳語誰沒收到花 單身女郎 如臨大敵', '燭光晚餐客滿 街頭情侶好閃 戴起墨鏡 今晚準備 寂寞  孤單', '十三號星期舞  專屬 盲目還比黑色恐怖 愛錯不如自己跳舞 十三號星期舞  熱舞 慶祝今天無拘無束 預祝明天找到幸福', '一個人睡覺是比較舒服 情人節不用煩惱買禮物 男朋友寧缺勿濫竽充數 二月十四 自己慶祝', '十三號星期舞  專屬 盲目還比黑色恐怖 愛錯不如自己跳舞 十三號星期舞  熱舞 慶祝今天無拘無束 預祝明天找到幸福', '包場電影 自己看也立體 慾望城市散步 有伴沒伴都酷 快樂住 自由住', '十三號星期舞  專屬 男男女女開心狂舞 不分你我整夜狂舞 十三號星期舞  狂舞 慶祝今天無拘無束 預祝明天找到幸福']",剩女們明天打算請病假，情人節聽到巧克力就怕，小圈圈耳語誰沒收到花，單身女郎，如臨大敵。燭光晚餐客滿，街頭情侶好閃，戴起墨鏡，今晚準備，寂寞，孤單。十三號星期舞，專屬，盲目還比黑色恐怖，愛錯不如自己跳舞，十三號星期舞，熱舞，慶祝今天無拘無束，預祝明天找到幸福。一個人睡覺是比較舒服，情人節不用煩惱買禮物，男朋友寧缺勿濫竽充數，二月十四，自己慶祝。十三號星期舞，專屬，盲目還比黑色恐怖，愛錯不如自己跳舞，十三號星期舞，熱舞，慶祝今天無拘無束，預祝明天找到幸福。包場電影，自己看也立體，慾望城市散步，有伴沒伴都酷，快樂住，自由住。十三號星期舞，專屬，男男女女開心狂舞，不分你我整夜狂舞，十三號星期舞，狂舞，慶祝今天無拘無束，預祝明天找到幸福,"['剩女們', '明天', '打算', '請', '病假', '，', '情人', '節聽', '到', '巧克力', '就', '怕', '，', '小圈', '圈圈', '小圈圈', '耳語', '誰', '沒', '收到', '花', '，', '單身', '女郎', '，', '如臨', '大敵', '。', '燭光', '晚餐', '客滿', '，', '街頭', '情侶', '好', '閃', '，', '戴起', '墨鏡', '，', '今晚', '準備', '，', '寂寞', '，', '孤單', '。', '十三', '號', '星期', '舞', '，', '專屬', '，', '盲目', '還比', '黑色', '恐怖', '，', '愛錯', '不如', '自己', '跳舞', '，', '十三', '號', '星期', '舞', '，', '熱舞', '，', '慶祝', '今天', '無拘無束', '，', '預祝', '明天', '找到', '幸福', '。', '一個', '人', '睡覺', '是', '比', '較', '舒服', '，', '情人', '節', '不用', '煩惱', '買', '禮物', '，', '朋友', '男朋友', '寧缺', '勿', '濫', '竽', '充數', '，', '二月', '十四', '，', '自己', '慶祝', '。', '十三', '號', '星期', '舞', '，', '專屬', '，', '盲目', '還比', '黑色', '恐怖', '，', '愛錯', '不如', '自己', '跳舞', '，', '十三', '號', '星期', '舞', '，', '熱舞', '，', '慶祝', '今天', '無拘無束', '，', '預祝', '明天', '找到', '幸福', '。', '包場', '電影', '，', '自己', '看', '也', '立體', '，', '慾', '望', '城市', '散步', '，', '有伴', '沒伴', '都', '酷', '，', '快樂住', '，', '自由', '住', '。', '十三', '號', '星期', '舞', '，', '專屬', '，', '男女', '男男女女', '開心', '狂舞', '，', '不分', '你', '我', '整夜', '狂舞', '，', '十三', '號', '星期', '舞', '，', '狂舞', '，', '慶祝', '今天', '無拘無束', '，', '預祝', '明天', '找到', '幸福']","['剩女', '們', '明天', '打算', '請', '病假', '，', '情人節', '聽到', '巧克力', '就', '怕', '，', '小', '圈圈', '耳語', '誰', '沒收到', '花', '，', '單身', '女郎', '，', '如臨大敵', '。', '燭光', '晚餐', '客滿', '，', '街頭', '情侶', '好', '閃', '，', '戴', '起', '墨鏡', '，', '今晚', '準備', '，', '寂寞', '，', '孤單', '。', '十三號', '星期舞', '，', '專屬', '，', '盲目', '還', '比', '黑色恐怖', '，', '愛錯', '不如', '自己', '跳舞', '，', '十三號', '星期舞', '，', '熱舞', '，', '慶祝', '今天', '無拘無束', '，', '預祝', '明天', '找到', '幸福', '。', '一', '個', '人', '睡覺', '是', '比較', '舒服', '，', '情人節', '不用', '煩惱', '買', '禮物', '，', '男朋友', '寧缺', '勿', '濫竽充數', '，', '二月', '十四', '，', '自己', '慶祝', '。', '十三號', '星期舞', '，', '專屬', '，', '盲目', '還', '比', '黑色恐怖', '，', '愛錯', '不如', '自己', '跳舞', '，', '十三號', '星期舞', '，', '熱舞', '，', '慶祝', '今天', '無拘無束', '，', '預祝', '明天', '找到', '幸福', '。', '包場', '電影', '，', '自己', '看', '也', '立體', '，', '慾望', '城市', '散步', '，', '有', '伴', '沒', '伴', '都', '酷', '，', '快樂', '住', '，', '自由', '住', '。', '十三號', '星期舞', '，', '專屬', '，', '男男女女', '開心', '狂舞', '，', '不', '分', '你我', '整', '夜', '狂舞', '，', '十三號', '星期舞', '，', '狂舞', '，', '慶祝', '今天', '無拘無束', '，', '預祝', '明天', '找到', '幸福']"
Beast,"['你感慨 他澎湃 等你懈怠 任他主宰 矇騙演練多變埋藏掩飾他的穢 接著趁機毀滅 目睹 情緒噴灑的 潑墨 揭露 纏住畫面的 心魔', '潛意識獨鬥掙脫他維護的段數 意識嘲弄謝幕 揭露 早已破舊的 詭屋 荒蕪 是他送來的 禮物']",你感慨，他澎湃，等你懈怠，任他主宰，矇騙演練多變埋藏掩飾他的穢，接著趁機毀滅，目睹，情緒噴灑的，潑墨，揭露，纏住畫面的，心魔。潛意識獨鬥掙脫他維護的段數，意識嘲弄謝幕，揭露，早已破舊的，詭屋，荒蕪，是他送來的，禮物,"['你', '感慨', '，', '他', '澎湃', '，', '等', '你', '懈怠', '，', '任', '他', '主宰', '，', '矇騙', '演練', '多變', '埋藏', '掩飾', '他', '的', '穢', '，', '接著', '趁機', '毀滅', '，', '目睹', '，', '情緒', '噴灑', '的', '，', '潑墨', '，', '揭露', '，', '纏住', '畫面', '的', '，', '心魔', '。', '潛意識', '獨鬥', '掙脫', '他', '維護', '的', '段數', '，', '意識', '嘲弄', '謝幕', '，', '揭露', '，', '早已', '破舊', '的', '，', '詭屋', '，', '荒蕪', '，', '是', '他', '送', '來', '的', '，', '禮物']","['你', '感慨', '，', '他', '澎湃', '，', '等', '你', '懈怠', '，', '任', '他', '主宰', '，', '矇騙', '演練', '多變', '埋藏', '掩飾', '他', '的', '穢', '，', '接著', '趁機', '毀滅', '，', '目睹', '，', '情緒', '噴灑', '的', '，', '潑墨', '，', '揭露', '，', '纏住', '畫面', '的', '，', '心魔', '。', '潛意識', '獨鬥', '掙脫', '他', '維護', '的', '段數', '，', '意識', '嘲弄', '謝幕', '，', '揭露', '，', '早已', '破舊', '的', '，', '詭屋', '，', '荒蕪', '，', '是', '他', '送來', '的', '，', '禮物']"
柵欄間隙偷窺你(Spying On You Behind The Fence),"['我想要 一些自己的光景 比船槳 劃破海洋還要輕 幻想著 你靠近時的呼吸 這感覺 已經足以叫人昏迷吧', '我想要 一些自己的邏輯 科學家 全都無法去分析 觀察著 你眨眼睛的頻率 這感覺 可以扛起一座森林吧 就算是 很幸福也不要太快相信', '還不要 太快揭穿這把戲 就讓我 繼續這完美的謎語 先保持 忽遠忽近的距離 就讓我 隔著這美麗的間隙 偷窺你', '我知道 這是自虐的遊戲 好像是 你隨時可能離去 雖然你的眼神那麼確定 對我說 再不可能找到唯一吧 我感到幸福 卻不敢太快去相信', '還不要 太快揭穿這把戲 就讓我 繼續這完美的謎語 先保持 忽遠忽近的距離 就讓我 隔著這美麗的間隙', '先別說愛 先別說愛 就讓我愛 愛愛愛著你', '我想要 等著你沉沉睡去 動物園 安于豢養的貓咪 嘲笑著 我把自由送給你 忍不住 得意忘形自己笑出聲音 此刻幸福是走進你的柵欄 圈住自己']",我想要，一些自己的光景，比船槳，劃破海洋還要輕，幻想著，你靠近時的呼吸，這感覺，已經足以叫人昏迷吧。我想要，一些自己的邏輯，科學家，全都無法去分析，觀察著，你眨眼睛的頻率，這感覺，可以扛起一座森林吧，就算是，很幸福也不要太快相信。還不要，太快揭穿這把戲，就讓我，繼續這完美的謎語，先保持，忽遠忽近的距離，就讓我，隔著這美麗的間隙，偷窺你。我知道，這是自虐的遊戲，好像是，你隨時可能離去，雖然你的眼神那麼確定，對我說，再不可能找到唯一吧，我感到幸福，卻不敢太快去相信。還不要，太快揭穿這把戲，就讓我，繼續這完美的謎語，先保持，忽遠忽近的距離，就讓我，隔著這美麗的間隙。先別說愛，先別說愛，就讓我愛，愛愛愛著你。我想要，等著你沉沉睡去，動物園，安于豢養的貓咪，嘲笑著，我把自由送給你，忍不住，得意忘形自己笑出聲音，此刻幸福是走進你的柵欄，圈住自己,"['我', '想要', '，', '一些', '自己', '的', '光景', '，', '比船', '槳', '，', '劃破', '海洋', '還要', '輕', '，', '幻想', '著', '，', '你', '靠近', '時', '的', '呼吸', '，', '這感覺', '，', '已經', '足以', '叫', '人', '昏迷', '吧', '。', '我', '想要', '，', '一些', '自己', '的', '邏輯', '，', '科學家', '，', '全都', '無法', '去', '分析', '，', '觀察著', '，', '你', '眨眼', '眼睛', '眨眼睛', '的', '頻率', '，', '這感覺', '，', '可以', '扛起', '一座', '森林', '吧', '，', '就算', '是', '，', '很', '幸福', '也', '不要', '太快', '相信', '。', '還', '不要', '，', '太快', '揭穿', '這把戲', '，', '就', '讓', '我', '，', '繼續', '這', '完美', '的', '謎語', '，', '先', '保持', '，', '忽遠', '忽近', '的', '距離', '，', '就', '讓', '我', '，', '隔著', '這美麗', '的', '間', '隙', '，', '偷', '窺', '你', '。', '我', '知道', '，', '這是', '自虐', '的', '遊戲', '，', '好像', '是', '，', '你', '隨時', '可能', '離去', '，', '雖然', '你', '的', '眼神', '那麼', '確定', '，', '對', '我', '說', '，', '再', '不', '可能', '找到', '唯一', '吧', '，', '我', '感到', '幸福', '，', '卻', '不敢', '太快', '去', '相信', '。', '還', '不要', '，', '太快', '揭穿', '這把戲', '，', '就', '讓', '我', '，', '繼續', '這', '完美', '的', '謎語', '，', '先', '保持', '，', '忽遠', '忽近', '的', '距離', '，', '就', '讓', '我', '，', '隔著', '這美麗', '的', '間', '隙', '。', '先別', '說', '愛', '，', '先別', '說', '愛', '，', '就', '讓', '我', '愛', '，', '愛愛愛著', '你', '。', '我', '想要', '，', '等', '著', '你', '沉沉', '睡', '去', '，', '動物園', '，', '安于', '豢養', '的', '貓咪', '，', '嘲笑', '著', '，', '我', '把', '自由', '送給', '你', '，', '不住', '忍不住', '，', '得意', '忘形', '得意忘形', '自己', '笑', '出聲音', '，', '此刻', '幸福', '是', '走', '進', '你', '的', '柵欄', '，', '圈住', '自己']","['我', '想要', '，', '一些', '自己', '的', '光景', '，', '比', '船槳', '，', '劃破', '海洋', '還要', '輕', '，', '幻想', '著', '，', '你', '靠近', '時', '的', '呼吸', '，', '這', '感覺', '，', '已經', '足以', '叫', '人', '昏迷', '吧', '。', '我', '想要', '，', '一些', '自己', '的', '邏輯', '，', '科學家', '，', '全', '都', '無法', '去', '分析', '，', '觀察', '著', '，', '你', '眨', '眼睛', '的', '頻率', '，', '這', '感覺', '，', '可以', '扛', '起', '一', '座', '森林', '吧', '，', '就算', '是', '，', '很', '幸福', '也', '不要', '太', '快', '相信', '。', '還', '不要', '，', '太', '快', '揭穿', '這', '把戲', '，', '就', '讓', '我', '，', '繼續', '這', '完美', '的', '謎語', '，', '先', '保持', '，', '忽', '遠', '忽', '近', '的', '距離', '，', '就', '讓', '我', '，', '隔', '著', '這', '美麗', '的', '間隙', '，', '偷窺', '你', '。', '我', '知道', '，', '這', '是', '自虐', '的', '遊戲', '，', '好像', '是', '，', '你', '隨時', '可能', '離去', '，', '雖然', '你', '的', '眼神', '那麼', '確定', '，', '對', '我', '說', '，', '再', '不可能', '找到', '唯一', '吧', '，', '我', '感到', '幸福', '，', '卻', '不', '敢', '太', '快', '去', '相信', '。', '還', '不', '要', '，', '太', '快', '揭穿', '這', '把戲', '，', '就', '讓', '我', '，', '繼續', '這', '完美', '的', '謎語', '，', '先', '保持', '，', '忽', '遠', '忽', '近', '的', '距離', '，', '就', '讓', '我', '，', '隔', '著', '這', '美麗', '的', '間隙', '。', '先', '別', '說', '愛', '，', '先', '別', '說', '愛', '，', '就', '讓', '我', '愛', '，', '愛', '愛', '愛', '著', '你', '。', '我', '想要', '，', '等', '著', '你', '沉沉', '睡去', '，', '動物園', '，', '安于', '豢養', '的', '貓咪', '，', '嘲笑', '著', '，', '我', '把', '自由', '送給', '你', '，', '忍不住', '，', '得意忘形', '自己', '笑出', '聲音', '，', '此刻', '幸福', '是', '走進', '你', '的', '柵欄', '，', '圈住', '自己']"
招牌動作,"['抬起頭  別害羞', '衣服穿什麼走什麼風格為什麼覺得妳的一切那麼眼熟 那口紅的顏色連走路的動作忙了幾個鐘頭努力當個分身幹什麼', '做事要原則做人要獨特跟舊的路線走怎麼可能會跑在前頭 一旦失去自我下一步該怎麼走前後左右可都是對手', '暫停一秒鐘想到了沒有沒有什麼對錯只要切記千萬別做錯 一旦找到自我看一眼就會記得隨波逐流可不會快樂', '抬起頭  舉個手  想個屬於你自己的招牌動作   甩個頭  扭一扭    他的目光會被你掌握', '不會錯最簡單那個動作 不會錯沒有人和妳會相同']",抬起頭，別害羞。衣服穿什麼走什麼風格為什麼覺得妳的一切那麼眼熟，那口紅的顏色連走路的動作忙了幾個鐘頭努力當個分身幹什麼。做事要原則做人要獨特跟舊的路線走怎麼可能會跑在前頭，一旦失去自我下一步該怎麼走前後左右可都是對手。暫停一秒鐘想到了沒有沒有什麼對錯只要切記千萬別做錯，一旦找到自我看一眼就會記得隨波逐流可不會快樂。抬起頭，舉個手，想個屬於你自己的招牌動作，甩個頭，扭一扭，他的目光會被你掌握。不會錯最簡單那個動作，不會錯沒有人和妳會相同,"['抬起', '頭', '，', '別', '害羞', '。', '衣服', '穿什麼', '走', '什麼', '風格', '為', '什麼', '覺得', '妳', '的', '一切', '那麼', '眼熟', '，', '那口紅', '的', '顏色連', '走路', '的', '動作', '忙', '了', '幾個', '鐘頭', '努力', '當個', '分身', '幹什麼', '。', '做事', '要', '原則', '做人', '要', '獨特', '跟', '舊', '的', '路線', '走', '怎麼', '可能', '會', '跑', '在', '前頭', '，', '一旦', '失去', '自我', '下', '一步', '該', '怎麼', '走', '前', '後', '左右', '可', '都', '是', '對', '手', '。', '暫停', '一秒', '鐘', '想到', '了', '沒', '有', '沒', '有', '什麼', '對', '錯', '只要', '切記', '千萬別', '做', '錯', '，', '一旦', '找到', '自我', '看', '一眼', '就會', '記得', '隨波', '逐流', '可不', '會', '快樂', '。', '抬起', '頭', '，', '舉個', '手', '，', '想個屬', '於', '你', '自己', '的', '招牌', '動作', '，', '甩個頭', '，', '扭一扭', '，', '他', '的', '目光', '會', '被', '你', '掌握', '。', '不會', '錯', '最', '簡單', '那個', '動作', '，', '不會', '錯', '沒', '有人', '和', '妳', '會', '相同']","['抬起', '頭', '，', '別', '害羞', '。', '衣服', '穿', '什麼', '走', '什麼', '風格', '為什麼', '覺得', '妳', '的', '一切', '那麼', '眼熟', '，', '那', '口紅', '的', '顏色', '連', '走路', '的', '動作', '忙', '了', '幾', '個', '鐘頭', '努力', '當', '個', '分身', '幹什麼', '。', '做', '事', '要', '原則', '做人', '要', '獨特', '跟', '舊', '的', '路線', '走', '怎麼', '可能', '會', '跑', '在', '前頭', '，', '一旦', '失去', '自我', '下', '一', '步', '該', '怎麼', '走', '前後', '左右', '可', '都', '是', '對手', '。', '暫停', '一', '秒鐘', '想到', '了', '沒有', '沒有', '什麼', '對錯', '只要', '切記', '千萬', '別', '做錯', '，', '一旦', '找到', '自我', '看', '一', '眼', '就', '會', '記得', '隨波逐流', '可', '不會', '快樂', '。', '抬起', '頭', '，', '舉', '個', '手', '，', '想', '個', '屬於', '你', '自己', '的', '招牌', '動作', '，', '甩', '個', '頭', '，', '扭', '一', '扭', '，', '他', '的', '目光', '會', '被', '你', '掌握', '。', '不會', '錯', '最', '簡單', '那', '個', '動作', '，', '不會', '錯', '沒有', '人', '和', '妳', '會', '相同']"
看我72變,"['夢裡面空氣開始冒煙 矇矓中完美的臉慢慢的出現 再見醜小鴨再見我要洗心革面 人定可以勝天夢想近在眼前', '今天、新鮮、改變、再見', '美麗極限愛漂亮沒有終點 追求完美的境界人不愛美天誅地滅 別氣餒舊觀念拋到一邊 現在就開始改變麻雀也能飛上青天', '再見面要你們傻了眼 無所謂正面側面都是完美弧線 再見醜小鴨再見自卑留給昨天 女大要十八變看我七十二變']",夢裡面空氣開始冒煙，矇矓中完美的臉慢慢的出現，再見醜小鴨再見我要洗心革面，人定可以勝天夢想近在眼前。今天、新鮮、改變、再見。美麗極限愛漂亮沒有終點，追求完美的境界人不愛美天誅地滅，別氣餒舊觀念拋到一邊，現在就開始改變麻雀也能飛上青天。再見面要你們傻了眼，無所謂正面側面都是完美弧線，再見醜小鴨再見自卑留給昨天，女大要十八變看我七十二變,"['夢裡面', '空氣', '開始', '冒', '煙', '，', '矇矓', '中', '完美', '的', '臉', '慢慢', '的', '出現', '，', '再見', '醜小鴨', '再', '見', '我', '要', '洗心', '洗心革面', '，', '人', '定', '可以', '勝天夢想', '近在', '眼前', '近在眼前', '。', '今天', '、', '新鮮', '、', '改變', '、', '再見', '。', '美麗', '極限愛', '漂亮', '沒有', '終點', '，', '追求', '完美', '的', '境界', '人不愛美天', '誅', '地滅', '，', '別氣餒', '舊', '觀念', '拋到', '一邊', '，', '現在', '就', '開始', '改變', '麻雀', '也', '能', '飛上', '青天', '。', '再見', '面要', '你', '們', '傻了眼', '，', '無所謂', '正面', '側面', '都', '是', '完美', '弧線', '，', '再見', '醜小鴨', '再', '見', '自卑', '留給', '昨天', '，', '大要', '女大要', '十八', '變看', '我', '七十', '十二', '七十二', '變']","['夢', '裡面', '空氣', '開始', '冒煙', '，', '矇矓', '中', '完美', '的', '臉', '慢慢', '的', '出現', '，', '再見', '醜小鴨', '再見', '我', '要', '洗心革面', '，', '人', '定', '可以', '勝', '天', '夢想', '近在眼前', '。', '今天', '、', '新鮮', '、', '改變', '、', '再見', '。', '美麗', '極限', '愛', '漂亮', '沒有', '終點', '，', '追求', '完美', '的', '境界人', '不', '愛', '美', '天誅地滅', '，', '別', '氣餒', '舊', '觀念', '拋到', '一', '邊', '，', '現在', '就', '開始', '改變', '麻雀', '也', '能', '飛上', '青天', '。', '再', '見面', '要', '你們', '傻', '了', '眼', '，', '無所謂', '正面', '側面', '都', '是', '完美', '弧線', '，', '再見', '醜小鴨', '再見', '自卑', '留給', '昨天', '，', '女大', '要', '十八', '變', '看', '我', '七十二', '變']"
野蠻遊戲,"['老虎老鼠傻傻分不清楚 滿臉泥土失敗的被俘虜 小賭豪賭想愛就別怕苦 看不清楚遲早粉身碎骨', '不知不覺其實妳已上線 感情的世界戰火連天 如果不想每一天以淚洗面 提高警覺快張大妳的雙眼', '偽善的臉妳要能懂得分辨 越是危險顏色越是鮮豔 寬大的肩可能會崩潰 放電的眼常常會漏電', '野蠻遊戲沒人被赦免 野蠻遊戲不同情可憐 野蠻遊戲快勇往直前 受傷在所難免都值得紀念', '⊙等到妳遇見完美的人選離勝利那天已經不遠', '不要害怕路上有人會攔阻 老天故意要讓妳覺得辛苦 永遠記得要自我保護 不要害怕暫時的孤獨', '⊙', '離勝利那天已經不遠', '老虎老鼠傻傻分不清楚 滿臉泥土失敗的被俘虜', '⊙', '離勝利那天已經很遠', '老虎老鼠傻傻分不清楚 老虎老鼠傻傻分不清楚']",老虎老鼠傻傻分不清楚，滿臉泥土失敗的被俘虜，小賭豪賭想愛就別怕苦，看不清楚遲早粉身碎骨。不知不覺其實妳已上線，感情的世界戰火連天，如果不想每一天以淚洗面，提高警覺快張大妳的雙眼。偽善的臉妳要能懂得分辨，越是危險顏色越是鮮豔，寬大的肩可能會崩潰，放電的眼常常會漏電。野蠻遊戲沒人被赦免，野蠻遊戲不同情可憐，野蠻遊戲快勇往直前，受傷在所難免都值得紀念。⊙等到妳遇見完美的人選離勝利那天已經不遠。不要害怕路上有人會攔阻，老天故意要讓妳覺得辛苦，永遠記得要自我保護，不要害怕暫時的孤獨。⊙。離勝利那天已經不遠。老虎老鼠傻傻分不清楚，滿臉泥土失敗的被俘虜。⊙。離勝利那天已經很遠。老虎老鼠傻傻分不清楚，老虎老鼠傻傻分不清楚,"['老虎', '老鼠', '傻傻', '清楚', '分不清', '分不清楚', '，', '滿臉', '泥土', '失敗', '的', '被俘', '虜', '，', '小', '賭豪', '賭想', '愛就別', '怕苦', '，', '清楚', '看不清', '看不清楚', '遲早', '粉身碎骨', '。', '不知', '不覺', '其實', '妳', '已', '上線', '，', '感情', '的', '世界', '戰火', '連天', '，', '如果', '不想', '每', '一天', '以淚', '洗面', '，', '提高', '警覺', '快', '張大', '妳', '的', '雙眼', '。', '偽善', '的', '臉', '妳', '要', '能', '懂得', '分辨', '，', '越是', '危險', '顏色', '越是', '鮮', '豔', '，', '寬大', '的', '肩', '可能', '會崩潰', '，', '放電', '的', '眼', '常常', '會', '漏電', '。', '野蠻', '遊戲', '沒人', '被', '赦免', '，', '野蠻', '遊戲', '不', '同情', '可憐', '，', '野蠻', '遊戲', '快', '勇往', '勇往直前', '，', '受傷', '在', '所', '難免', '都', '值得', '紀念', '。', '⊙', '等到', '妳', '遇見', '完美', '的', '人', '選離', '勝利', '那天', '已經', '不遠', '。', '不要', '害怕', '路上', '有人', '會', '攔阻', '，', '老天', '故意', '要', '讓', '妳', '覺得', '辛苦', '，', '永遠', '記得', '要', '自我', '保護', '，', '不要', '害怕', '暫時', '的', '孤獨', '。', '⊙', '。', '離勝利', '那天', '已經', '不遠', '。', '老虎', '老鼠', '傻傻', '清楚', '分不清', '分不清楚', '，', '滿臉', '泥土', '失敗', '的', '被俘', '虜', '。', '⊙', '。', '離勝利', '那天', '已經', '很', '遠', '。', '老虎', '老鼠', '傻傻', '清楚', '分不清', '分不清楚', '，', '老虎', '老鼠', '傻傻', '清楚', '分不清', '分不清楚']","['老虎', '老鼠', '傻傻', '分', '不', '清楚', '，', '滿', '臉', '泥土', '失敗', '的', '被', '俘虜', '，', '小', '賭豪', '賭', '想', '愛', '就', '別', '怕', '苦', '，', '看', '不', '清楚', '遲早', '粉身碎骨', '。', '不知不覺', '其實', '妳', '已', '上線', '，', '感情', '的', '世界', '戰火', '連天', '，', '如果', '不', '想', '每', '一', '天', '以', '淚', '洗面', '，', '提高', '警覺', '快', '張大', '妳', '的', '雙眼', '。', '偽善', '的', '臉', '妳', '要', '能', '懂得', '分辨', '，', '越', '是', '危險', '顏色', '越', '是', '鮮豔', '，', '寬大', '的', '肩', '可能', '會', '崩潰', '，', '放電', '的', '眼', '常常', '會', '漏電', '。', '野蠻', '遊戲', '沒', '人', '被', '赦免', '，', '野蠻', '遊戲', '不', '同情', '可憐', '，', '野蠻', '遊戲', '快', '勇往直前', '，', '受傷', '在所難免', '都', '值得', '紀念', '。', '⊙', '等到', '妳', '遇見', '完美', '的', '人選離', '勝利', '那', '天', '已經', '不遠', '。', '不要', '害怕', '路', '上', '有', '人', '會', '攔阻', '，', '老天', '故意', '要', '讓', '妳', '覺得', '辛苦', '，', '永遠', '記得', '要', '自我', '保護', '，', '不要', '害怕', '暫時', '的', '孤獨', '。', '⊙', '。', '離', '勝利', '那', '天', '已經', '不遠', '。', '老虎', '老鼠', '傻傻', '分', '不', '清楚', '，', '滿', '臉', '泥土', '失敗', '的', '被', '俘虜', '。', '⊙', '。', '離', '勝利', '那', '天', '已經', '很', '遠', '。', '老虎', '老鼠', '傻傻', '分', '不', '清楚', '，', '老虎', '老鼠', '傻傻', '分', '不', '清楚']"
