trackName,lyric_line,lyric_full,lyric_jieba,lyric_ckip
親愛的對象,"['電影 關於我和鬼變成家人的那件事 主題曲', '有些事 太固執 也許是 在等你 推翻 解答 多不平常', '我 也放棄線索 預設立場 沒對錯 又怎樣', '好在我們 從不必說明 什麼關係 都沒關係 很單純 很嚮往 尋找親愛的對象 本質一樣', '真的存在 這種感情 依賴沒必要 再小心翼翼 你有接住我的方法 我去哪裡飛翔 你都會在場', '因為有差異 才能從理解中 感覺 更熟悉 在歲月留下 溫柔回憶', '試探 想沿著 時間線的推移 好或壞 都待續', '好在我們 從不必說明 什麼關係 都沒關係 很單純 很嚮往 尋找親愛的對象 本質一樣', '曾為誰受過傷 很缺憾的時光 在消散之前 就用愛原諒', '你遺落的願望 我陪你 一起學不會放下 但學會盼望', '最後我們 像家人貼近 能給的關心 不只關心 不約定 不勉強 這種親愛的對象 彷彿更理想', '對的人可能 成為伴侶 或關於你我 擁有了默契 我有找到你的方法 你去哪裡飛翔 我都會到場', '最後我們 像家人貼近 能給的關心 不只關心 不約定 不勉強 這種親愛的對象 彷彿更理想', '對的人可能 成為伴侶 或關於你我 擁有了默契 陪伴是 我們擅長 我的生命 少不了你 在場']",電影，關於我和鬼變成家人的那件事，主題曲。有些事，太固執，也許是，在等你，推翻，解答，多不平常。我，也放棄線索，預設立場，沒對錯，又怎樣。好在我們，從不必說明，什麼關係，都沒關係，很單純，很嚮往，尋找親愛的對象，本質一樣。真的存在，這種感情，依賴沒必要，再小心翼翼，你有接住我的方法，我去哪裡飛翔，你都會在場。因為有差異，才能從理解中，感覺，更熟悉，在歲月留下，溫柔回憶。試探，想沿著，時間線的推移，好或壞，都待續。好在我們，從不必說明，什麼關係，都沒關係，很單純，很嚮往，尋找親愛的對象，本質一樣。曾為誰受過傷，很缺憾的時光，在消散之前，就用愛原諒。你遺落的願望，我陪你，一起學不會放下，但學會盼望。最後我們，像家人貼近，能給的關心，不只關心，不約定，不勉強，這種親愛的對象，彷彿更理想。對的人可能，成為伴侶，或關於你我，擁有了默契，我有找到你的方法，你去哪裡飛翔，我都會到場。最後我們，像家人貼近，能給的關心，不只關心，不約定，不勉強，這種親愛的對象，彷彿更理想。對的人可能，成為伴侶，或關於你我，擁有了默契，陪伴是，我們擅長，我的生命，少不了你，在場,"['電影', '，', '關於', '我', '和', '鬼', '變成', '家人', '的', '那件', '那件事', '，', '主題', '曲', '。', '有些', '事', '，', '太固執', '，', '也', '許是', '，', '在', '等', '你', '，', '推翻', '，', '解答', '，', '多', '不', '平常', '。', '我', '，', '也', '放棄', '線索', '，', '預設', '立場', '，', '沒對', '錯', '，', '又', '怎樣', '。', '好', '在', '我們', '，', '從', '不必', '說明', '，', '什麼關', '係', '，', '都', '沒關', '係', '，', '很', '單純', '，', '很', '嚮', '往', '，', '尋找', '親愛的', '對象', '，', '本質', '一樣', '。', '真的', '存在', '，', '這種', '感情', '，', '依賴', '沒', '必要', '，', '再', '小心', '翼翼', '小心翼翼', '，', '你', '有', '接住', '我', '的', '方法', '，', '我', '去', '哪裡', '飛翔', '，', '你', '都', '會', '在場', '。', '因為', '有', '差異', '，', '才能', '從', '理解', '中', '，', '感覺', '，', '更', '熟悉', '，', '在', '歲', '月', '留下', '，', '溫柔', '回憶', '。', '試探', '，', '想', '沿著', '，', '時間', '線', '的', '推移', '，', '好', '或', '壞', '，', '都', '待續', '。', '好', '在', '我們', '，', '從', '不必', '說明', '，', '什麼關', '係', '，', '都', '沒關', '係', '，', '很', '單純', '，', '很', '嚮', '往', '，', '尋找', '親愛的', '對象', '，', '本質', '一樣', '。', '曾', '為', '誰', '受', '過傷', '，', '很', '缺憾', '的', '時光', '，', '在', '消散', '之前', '，', '就', '用', '愛原諒', '。', '你', '遺落', '的', '願望', '，', '我', '陪', '你', '，', '一起', '學不會', '放下', '，', '但學會', '盼望', '。', '最後我們', '，', '像', '家人', '貼近', '，', '能給', '的', '關心', '，', '不', '只', '關心', '，', '不約定', '，', '不', '勉強', '，', '這種', '親愛的', '對象', '，', '彷', '彿', '更', '理想', '。', '對', '的', '人', '可能', '，', '成為', '伴侶', '，', '或關', '於', '你', '我', '，', '擁有', '了', '默契', '，', '我', '有', '找到', '你', '的', '方法', '，', '你', '去', '哪裡', '飛翔', '，', '我', '都', '會', '到場', '。', '最後我們', '，', '像', '家人', '貼近', '，', '能給', '的', '關心', '，', '不', '只', '關心', '，', '不約定', '，', '不', '勉強', '，', '這種', '親愛的', '對象', '，', '彷', '彿', '更', '理想', '。', '對', '的', '人', '可能', '，', '成為', '伴侶', '，', '或關', '於', '你', '我', '，', '擁有', '了', '默契', '，', '陪伴', '是', '，', '我們', '擅長', '，', '我', '的', '生命', '，', '不了', '少不了', '你', '，', '在場']","['電影', '，', '關於', '我', '和', '鬼', '變成', '家人', '的', '那', '件', '事', '，', '主題曲', '。', '有', '些', '事', '，', '太', '固執', '，', '也許', '是', '，', '在', '等', '你', '，', '推翻', '，', '解答', '，', '多', '不', '平常', '。', '我', '，', '也', '放棄', '線索', '，', '預設', '立場', '，', '沒', '對錯', '，', '又', '怎樣', '。', '好在', '我們', '，', '從', '不必', '說明', '，', '什麼', '關係', '，', '都', '沒關係', '，', '很', '單純', '，', '很', '嚮往', '，', '尋找', '親愛', '的', '對象', '，', '本質', '一樣', '。', '真的', '存在', '，', '這', '種', '感情', '，', '依賴', '沒', '必要', '，', '再', '小心翼翼', '，', '你', '有', '接住', '我', '的', '方法', '，', '我', '去', '哪裡', '飛翔', '，', '你', '都', '會', '在場', '。', '因為', '有', '差異', '，', '才', '能', '從', '理解', '中', '，', '感覺', '，', '更', '熟悉', '，', '在', '歲月', '留下', '，', '溫柔', '回憶', '。', '試探', '，', '想', '沿著', '，', '時間線', '的', '推移', '，', '好', '或', '壞', '，', '都', '待續', '。', '好在', '我們', '，', '從', '不必', '說明', '，', '什麼', '關係', '，', '都', '沒關係', '，', '很', '單純', '，', '很', '嚮往', '，', '尋找', '親愛', '的', '對象', '，', '本質', '一樣', '。', '曾', '為', '誰', '受', '過', '傷', '，', '很', '缺憾', '的', '時光', '，', '在', '消散', '之前', '，', '就', '用', '愛', '原諒', '。', '你', '遺落', '的', '願望', '，', '我', '陪', '你', '，', '一起', '學', '不會', '放下', '，', '但', '學會', '盼望', '。', '最後', '我們', '，', '像', '家人', '貼近', '，', '能', '給', '的', '關心', '，', '不只', '關心', '，', '不', '約定', '，', '不', '勉強', '，', '這', '種', '親愛的', '對象', '，', '彷彿', '更', '理想', '。', '對', '的', '人', '可能', '，', '成為', '伴侶', '，', '或', '關於', '你我', '，', '擁有', '了', '默契', '，', '我', '有', '找到', '你', '的', '方法', '，', '你', '去', '哪裡', '飛翔', '，', '我', '都', '會', '到場', '。', '最後', '我們', '，', '像', '家人', '貼近', '，', '能', '給', '的', '關心', '，', '不只', '關心', '，', '不', '約定', '，', '不', '勉強', '，', '這', '種', '親愛的', '對象', '，', '彷彿', '更', '理想', '。', '對', '的', '人', '可能', '，', '成為', '伴侶', '，', '或', '關於', '你我', '，', '擁有', '了', '默契', '，', '陪伴', '是', '，', '我們', '擅長', '，', '我', '的', '生命', '，', '少不了', '你', '，', '在場']"
我是誰,"['狼殿下 主題曲', '習慣了黑的深邃 再野 也無畏 等星墜的餘輝 照亮誰 流放者的同類 藏著寂寞在防衛 但溫柔總是無堅不摧', '沒遇見你我是誰 沒有你的我是誰 沒有你 無所謂 我是誰 習慣了黑的深邃 再野也無畏 看星墜的餘輝照亮誰 流放者等同類 藏著寂寞在防衛 但溫柔總是無堅不摧', '但讓我知道我是誰也給我一個目的地', '沒遇見你我是誰 沒有你的我是誰 當懸絲的傀儡 有過溫度的體會 瞳孔裡不再是黑白灰', '冷漠是盔甲裡的人強忍的傷悲 一滴淚就能被摧毀  : 你拿走我的在乎我的所有注意力', '拒絕向宿命妥協因為心有所歸 是你的 我不屬於誰  : 但讓我知道我是誰也給我一個目的地', '沒遇見你我是誰  : 你拿走我的在乎我的所有注意力', '沒有你的我是誰  : 但讓我知道我是誰也給我一個目的地', '當懸絲的傀儡 有過溫度的體會 瞳孔裡不再是黑白灰  : 你拿走我的在乎我的所有注意力', '瞳孔裡不再是黑白灰  : 但讓我知道我是誰也給我一個目的地', '你知道 我是誰']",狼殿下，主題曲。習慣了黑的深邃，再野，也無畏，等星墜的餘輝，照亮誰，流放者的同類，藏著寂寞在防衛，但溫柔總是無堅不摧。沒遇見你我是誰，沒有你的我是誰，沒有你，無所謂，我是誰，習慣了黑的深邃，再野也無畏，看星墜的餘輝照亮誰，流放者等同類，藏著寂寞在防衛，但溫柔總是無堅不摧。但讓我知道我是誰也給我一個目的地。沒遇見你我是誰，沒有你的我是誰，當懸絲的傀儡，有過溫度的體會，瞳孔裡不再是黑白灰。冷漠是盔甲裡的人強忍的傷悲，一滴淚就能被摧毀，:，你拿走我的在乎我的所有注意力。拒絕向宿命妥協因為心有所歸，是你的，我不屬於誰，:，但讓我知道我是誰也給我一個目的地。沒遇見你我是誰，:，你拿走我的在乎我的所有注意力。沒有你的我是誰，:，但讓我知道我是誰也給我一個目的地。當懸絲的傀儡，有過溫度的體會，瞳孔裡不再是黑白灰，:，你拿走我的在乎我的所有注意力。瞳孔裡不再是黑白灰，:，但讓我知道我是誰也給我一個目的地。你知道，我是誰,"['狼', '殿下', '，', '主題', '曲', '。', '習慣', '了', '黑', '的', '深邃', '，', '再野', '，', '也', '無畏', '，', '等星', '墜', '的', '餘輝', '，', '照亮', '誰', '，', '流放', '者', '的', '同類', '，', '藏著', '寂寞', '在', '防衛', '，', '但', '溫柔', '總', '是', '無', '堅不摧', '。', '沒遇', '見', '你', '我', '是', '誰', '，', '沒有', '你', '的', '我', '是', '誰', '，', '沒有', '你', '，', '無所謂', '，', '我', '是', '誰', '，', '習慣', '了', '黑', '的', '深邃', '，', '再野', '也', '無畏', '，', '看星', '墜', '的', '餘輝', '照亮', '誰', '，', '流放', '者', '等同', '類', '，', '藏著', '寂寞', '在', '防衛', '，', '但', '溫柔', '總', '是', '無', '堅不摧', '。', '但', '讓', '我', '知道', '我', '是', '誰', '也給', '我', '一個', '目的', '目的地', '。', '沒遇', '見', '你', '我', '是', '誰', '，', '沒有', '你', '的', '我', '是', '誰', '，', '當懸絲', '的', '傀儡', '，', '有過', '溫度', '的', '體會', '，', '瞳孔', '裡', '不再', '是', '黑白', '灰', '。', '冷漠', '是', '盔甲', '裡的', '人', '強忍', '的', '傷悲', '，', '一滴', '淚', '就', '能', '被', '摧毀', '，', ':', '，', '你', '拿走', '我', '的', '在乎', '我', '的', '所有', '注意', '注意力', '。', '拒絕', '向', '宿命', '妥協', '因為', '心', '有所', '歸', '，', '是', '你', '的', '，', '我', '不屬', '於', '誰', '，', ':', '，', '但', '讓', '我', '知道', '我', '是', '誰', '也給', '我', '一個', '目的', '目的地', '。', '沒遇', '見', '你', '我', '是', '誰', '，', ':', '，', '你', '拿走', '我', '的', '在乎', '我', '的', '所有', '注意', '注意力', '。', '沒有', '你', '的', '我', '是', '誰', '，', ':', '，', '但', '讓', '我', '知道', '我', '是', '誰', '也給', '我', '一個', '目的', '目的地', '。', '當懸絲', '的', '傀儡', '，', '有過', '溫度', '的', '體會', '，', '瞳孔', '裡', '不再', '是', '黑白', '灰', '，', ':', '，', '你', '拿走', '我', '的', '在乎', '我', '的', '所有', '注意', '注意力', '。', '瞳孔', '裡', '不再', '是', '黑白', '灰', '，', ':', '，', '但', '讓', '我', '知道', '我', '是', '誰', '也給', '我', '一個', '目的', '目的地', '。', '你', '知道', '，', '我', '是', '誰']","['狼殿', '下', '，', '主題曲', '。', '習慣', '了', '黑', '的', '深邃', '，', '再', '野', '，', '也', '無畏', '，', '等', '星墜', '的', '餘輝', '，', '照亮', '誰', '，', '流放', '者', '的', '同', '類', '，', '藏', '著', '寂寞', '在', '防衛', '，', '但', '溫柔', '總是', '無堅不摧', '。', '沒', '遇見', '你我', '是', '誰', '，', '沒有', '你', '的', '我', '是', '誰', '，', '沒有', '你', '，', '無所謂', '，', '我', '是', '誰', '，', '習慣', '了', '黑', '的', '深邃', '，', '再', '野', '也', '無畏', '，', '看', '星墜', '的', '餘輝', '照亮', '誰', '，', '流放', '者', '等同', '類', '，', '藏', '著', '寂寞', '在', '防衛', '，', '但', '溫柔', '總是', '無堅不摧', '。', '但', '讓', '我', '知道', '我', '是', '誰', '也', '給', '我', '一', '個', '目的地', '。', '沒', '遇見', '你我', '是', '誰', '，', '沒有', '你', '的', '我', '是', '誰', '，', '當', '懸絲', '的', '傀儡', '，', '有', '過', '溫度', '的', '體會', '，', '瞳孔', '裡', '不再', '是', '黑白灰', '。', '冷漠', '是', '盔甲', '裡', '的', '人', '強忍', '的', '傷悲', '，', '一', '滴', '淚', '就', '能', '被', '摧毀', '，', ':', '，', '你', '拿走', '我', '的', '在乎', '我', '的', '所有', '注意力', '。', '拒絕', '向', '宿命', '妥協', '因為', '心', '有所', '歸', '，', '是', '你', '的', '，', '我', '不', '屬於', '誰', '，', ':', '，', '但', '讓', '我', '知道', '我', '是', '誰', '也', '給', '我', '一', '個', '目的地', '。', '沒', '遇見', '你我', '是', '誰', '，', ':', '，', '你', '拿走', '我', '的', '在乎', '我', '的', '所有', '注意力', '。', '沒有', '你', '的', '我', '是', '誰', '，', ':', '，', '但', '讓', '我', '知道', '我', '是', '誰', '也', '給', '我', '一', '個', '目的地', '。', '當', '懸絲', '的', '傀儡', '，', '有', '過', '溫度', '的', '體會', '，', '瞳孔', '裡', '不再', '是', '黑白灰', '，', ':', '，', '你', '拿走', '我', '的', '在乎', '我', '的', '所有', '注意力', '。', '瞳孔', '裡', '不再', '是', '黑白灰', '，', ':', '，', '但', '讓', '我', '知道', '我', '是', '誰', '也', '給', '我', '一', '個', '目的地', '。', '你', '知道', '，', '我', '是', '誰']"
